{
  "id": "abcdefghijk",
  "tese": "Escale o julgamento humano, não o tamanho do modelo",
  "tldr": [
    "O Reddit usa modelos pequenos guiados por critérios escritos por pessoas.",
    "O ganho veio de melhorar as instruções de avaliação, sem trocar de modelo.",
    "Evals feitos com exemplos reais evitaram regressões em produção."
  ],
  "tema": "evals",
  "complexidade": 4,
  "ideias": [
    {"titulo": "Critério antes de modelo", "texto": "A equipe escreveu critérios claros do que é uma boa resposta antes de testar qualquer modelo novo.", "momento": {"t": 30, "descricao": "slide com a lista de critérios", "legenda": "Os critérios que guiam o avaliador"}},
    {"titulo": "Um juiz automático", "texto": "Um modelo lê cada resposta e dá nota seguindo os critérios, como um corretor de prova com gabarito.", "momento": {"t": 300, "descricao": "diagrama do fluxo do juiz", "legenda": "O fluxo do avaliador automático"}},
    {"titulo": "Medir antes de trocar", "texto": "Toda troca de modelo passa pela mesma bateria de testes antes de ir para produção.", "momento": {"t": 600, "descricao": "gráfico de acurácia por versão", "legenda": "A acurácia subiu sem trocar o modelo"}}
  ],
  "conceitos": [
    {"nome": "eval", "traducao": "avaliação", "nivel": "basico", "trecho_t": [20, 90]},
    {"nome": "LLM-as-judge", "traducao": "modelo como juiz", "nivel": "avancado", "trecho_t": [280, 420]}
  ],
  "leitura_critica": "Os números vêm de um único produto do Reddit e não há comparação com outras equipes.",
  "acoes": ["Escreva três critérios do que é uma boa resposta antes de trocar de modelo."],
  "numeros": [{"valor": "3x", "contexto": "menos regressões após os evals", "t": 610}]
}
